{
  "statement_kind": "trackone.disclosure-bundle.v1",
  "issuer": "did:x509:0:sha256:AAAAAAAAAAAAAAAAAAAAAAAAAAAAAAAAAAAAAAAAAAA::subject:CN:TrackOne-Publisher",
  "subject": "urn:trackone:disclosure-bundle:sha256:2ef641db9a118af6a40472c5db1c40e23484ab68b8fc4cf21926c66ee60daf35",
  "bundle": {
    "media_type": "application/x-tar",
    "digest_algorithm": "sha-256",
    "digest": "2ef641db9a118af6a40472c5db1c40e23484ab68b8fc4cf21926c66ee60daf35"
  },
  "disclosure_class": "A",
  "ledger_id": "b7a1d5e40c6f438e9a75db27c96f31aa",
  "segment_number": "0",
  "commitment_profile_id": "c08ade4e-1785-4eb6-9648-b7003d76288d"
}
